{
  "schemaVersion": "1.0",
  "kind": "visual-synthetic-semantic-declaration",
  "declarationId": "junior-readable-measurement-semantic-declaration",
  "caseId": "junior-readable-measurement",
  "subjectPack": "junior-physics-answer",
  "fixtureKind": "synthetic_fixture",
  "dataClassification": {
    "level": "public",
    "notes": "Explicit semantic role for one fully synthetic public fixture."
  },
  "truth": {
    "artifactRef": "eval/visual-ocr-diagnostics/cases/junior-readable-measurement.visual-synthetic-text-truth.json",
    "rawByteSha256": "b578283d6cfe4e1fe3bbc0aae1709301891d3f228995170f1ad161b9a9e0c267",
    "truthId": "junior-readable-measurement-synthetic-text-truth",
    "truthLabelRef": "truth-label-001"
  },
  "crop": {
    "artifactRef": "junior-readable-measurement.crop-2x.png",
    "scale": 2,
    "rawByteSha256": "619e236453646fdb4dfb772b3e8ead65e0597c6118af089f731a57cd57633aa6",
    "decodedRgbPixelSha256": "ac5f2a7abd8ad3aeb98c83ce2db7f9cf2d02b1b7cd357aba0c8323b94b1b01ef",
    "pixelSize": {
      "width": 160,
      "height": 96
    }
  },
  "semanticRole": "measurement_reading",
  "authorityProvenance": {
    "authorityKind": "explicit_synthetic_semantic_declaration",
    "interpreter": {
      "implementation": "CPython",
      "version": "3.13.7"
    },
    "liveProvider": false,
    "cloudEgress": false
  },
  "generatedAt": "2026-07-29T08:03:00Z"
}
